{
  "$schema": "https://json-schema.org/draft/2020-12/schema",
  "$id": "https://vexil-lang.org/release/stewardship/assignments.json",
  "assignmentSchema": "https://vexil-lang.org/release/schemas/stewardship-assignment.schema.json",
  "version": "1.0",
  "decision": {
    "id": "sole-maintainer-governance-2026-07-23",
    "status": "sole-maintainer-governance",
    "effectiveFrom": "2026-07-23",
    "reviewEvidence": {"decisionId": "sole-maintainer-governance-2026-07-23", "source": "https://github.com/vexil-lang/vexil/issues/75", "reviewedBy": "github:furkanmamuk", "reviewedAt": "2026-07-23"}
  },
  "identities": [
    {"id": "github:furkanmamuk", "name": "Furkan Mamuk", "email": "mamukfurkan@outlook.com", "github": "furkanmamuk"}
  ],
  "assignments": [
    {"assignmentId": "assignment-release-steward-2026-07-14", "roleId": "release-steward", "primaryActorId": "github:furkanmamuk", "scope": {"kind": "release-manifest-lifecycle", "root": "release-manifest-lifecycle"}, "effectiveFrom": "2026-07-14", "reviewEvidence": {"decisionId": "sole-maintainer-governance-2026-07-23", "source": "https://github.com/vexil-lang/vexil/issues/75", "reviewedBy": "github:furkanmamuk", "reviewedAt": "2026-07-23"}, "continuityProcedure": "The sole-maintainer policy removes the distinct-custodian gate; independent evidence gates still block approval and publication.", "status": "active"},
    {"assignmentId": "assignment-repository-administrator-2026-07-14", "roleId": "repository-administrator", "primaryActorId": "github:furkanmamuk", "scope": {"kind": "repository", "root": "."}, "effectiveFrom": "2026-07-14", "reviewEvidence": {"decisionId": "sole-maintainer-governance-2026-07-23", "source": "https://github.com/vexil-lang/vexil/issues/75", "reviewedBy": "github:furkanmamuk", "reviewedAt": "2026-07-23"}, "continuityProcedure": "Use the unavailable-owner containment route; it cannot authorize publication and no designated successor exists.", "status": "active"},
    {"assignmentId": "assignment-security-steward-2026-07-14", "roleId": "security-steward", "primaryActorId": "github:furkanmamuk", "scope": {"kind": "security-governance", "root": "."}, "effectiveFrom": "2026-07-14", "reviewEvidence": {"decisionId": "sole-maintainer-governance-2026-07-23", "source": "https://github.com/vexil-lang/vexil/issues/75", "reviewedBy": "github:furkanmamuk", "reviewedAt": "2026-07-23"}, "continuityProcedure": "Use the unavailable-owner containment route; it cannot accept risk or authorize publication and no designated successor exists.", "status": "active"},
    {"assignmentId": "assignment-release-run-coordinator-2026-07-14", "roleId": "release-run-coordinator", "primaryActorId": "github:furkanmamuk", "scope": {"kind": "release-run-execution", "root": "release-run-execution"}, "effectiveFrom": "2026-07-14", "reviewEvidence": {"decisionId": "sole-maintainer-governance-2026-07-23", "source": "https://github.com/vexil-lang/vexil/issues/75", "reviewedBy": "github:furkanmamuk", "reviewedAt": "2026-07-23"}, "continuityProcedure": "Sequence only already-authorized actions; independent evidence gates prevent privileged execution.", "status": "active"},
    {"assignmentId": "assignment-package-steward-vexil-lang-2026-07-14", "roleId": "package-steward", "primaryActorId": "github:furkanmamuk", "scope": {"kind": "maintained-root", "root": "crates/vexil-lang"}, "effectiveFrom": "2026-07-14", "reviewEvidence": {"decisionId": "sole-maintainer-governance-2026-07-23", "source": "https://github.com/vexil-lang/vexil/issues/75", "reviewedBy": "github:furkanmamuk", "reviewedAt": "2026-07-23"}, "continuityProcedure": "Record containment or a future successor through the unavailable-owner route; no release authority is created.", "status": "active"},
    {"assignmentId": "assignment-package-steward-vexilc-2026-07-14", "roleId": "package-steward", "primaryActorId": "github:furkanmamuk", "scope": {"kind": "maintained-root", "root": "crates/vexilc"}, "effectiveFrom": "2026-07-14", "reviewEvidence": {"decisionId": "sole-maintainer-governance-2026-07-23", "source": "https://github.com/vexil-lang/vexil/issues/75", "reviewedBy": "github:furkanmamuk", "reviewedAt": "2026-07-23"}, "continuityProcedure": "Record containment or a future successor through the unavailable-owner route; no release authority is created.", "status": "active"},
    {"assignmentId": "assignment-package-steward-vexil-runtime-2026-07-14", "roleId": "package-steward", "primaryActorId": "github:furkanmamuk", "scope": {"kind": "maintained-root", "root": "crates/vexil-runtime"}, "effectiveFrom": "2026-07-14", "reviewEvidence": {"decisionId": "sole-maintainer-governance-2026-07-23", "source": "https://github.com/vexil-lang/vexil/issues/75", "reviewedBy": "github:furkanmamuk", "reviewedAt": "2026-07-23"}, "continuityProcedure": "Record containment or a future successor through the unavailable-owner route; no release authority is created.", "status": "active"},
    {"assignmentId": "assignment-package-steward-codegen-rust-2026-07-14", "roleId": "package-steward", "primaryActorId": "github:furkanmamuk", "scope": {"kind": "maintained-root", "root": "crates/vexil-codegen-rust"}, "effectiveFrom": "2026-07-14", "reviewEvidence": {"decisionId": "sole-maintainer-governance-2026-07-23", "source": "https://github.com/vexil-lang/vexil/issues/75", "reviewedBy": "github:furkanmamuk", "reviewedAt": "2026-07-23"}, "continuityProcedure": "Record containment or a future successor through the unavailable-owner route; no release authority is created.", "status": "active"},
    {"assignmentId": "assignment-package-steward-codegen-ts-2026-07-14", "roleId": "package-steward", "primaryActorId": "github:furkanmamuk", "scope": {"kind": "maintained-root", "root": "crates/vexil-codegen-ts"}, "effectiveFrom": "2026-07-14", "reviewEvidence": {"decisionId": "sole-maintainer-governance-2026-07-23", "source": "https://github.com/vexil-lang/vexil/issues/75", "reviewedBy": "github:furkanmamuk", "reviewedAt": "2026-07-23"}, "continuityProcedure": "Record containment or a future successor through the unavailable-owner route; no release authority is created.", "status": "active"},
    {"assignmentId": "assignment-package-steward-codegen-go-2026-07-14", "roleId": "package-steward", "primaryActorId": "github:furkanmamuk", "scope": {"kind": "maintained-root", "root": "crates/vexil-codegen-go"}, "effectiveFrom": "2026-07-14", "reviewEvidence": {"decisionId": "sole-maintainer-governance-2026-07-23", "source": "https://github.com/vexil-lang/vexil/issues/75", "reviewedBy": "github:furkanmamuk", "reviewedAt": "2026-07-23"}, "continuityProcedure": "Record containment or a future successor through the unavailable-owner route; no release authority is created.", "status": "active"},
    {"assignmentId": "assignment-package-steward-codegen-py-2026-07-14", "roleId": "package-steward", "primaryActorId": "github:furkanmamuk", "scope": {"kind": "maintained-root", "root": "crates/vexil-codegen-py"}, "effectiveFrom": "2026-07-14", "reviewEvidence": {"decisionId": "sole-maintainer-governance-2026-07-23", "source": "https://github.com/vexil-lang/vexil/issues/75", "reviewedBy": "github:furkanmamuk", "reviewedAt": "2026-07-23"}, "continuityProcedure": "Record containment or a future successor through the unavailable-owner route; no release authority is created.", "status": "active"},
    {"assignmentId": "assignment-package-steward-store-2026-07-14", "roleId": "package-steward", "primaryActorId": "github:furkanmamuk", "scope": {"kind": "maintained-root", "root": "crates/vexil-store"}, "effectiveFrom": "2026-07-14", "reviewEvidence": {"decisionId": "sole-maintainer-governance-2026-07-23", "source": "https://github.com/vexil-lang/vexil/issues/75", "reviewedBy": "github:furkanmamuk", "reviewedAt": "2026-07-23"}, "continuityProcedure": "Record containment or a future successor through the unavailable-owner route; no release authority is created.", "status": "active"},
    {"assignmentId": "assignment-package-steward-runtime-ts-2026-07-14", "roleId": "package-steward", "primaryActorId": "github:furkanmamuk", "scope": {"kind": "maintained-root", "root": "packages/runtime-ts"}, "effectiveFrom": "2026-07-14", "reviewEvidence": {"decisionId": "sole-maintainer-governance-2026-07-23", "source": "https://github.com/vexil-lang/vexil/issues/75", "reviewedBy": "github:furkanmamuk", "reviewedAt": "2026-07-23"}, "continuityProcedure": "Record containment or a future successor through the unavailable-owner route; no release authority is created.", "status": "active"},
    {"assignmentId": "assignment-package-steward-runtime-py-2026-07-14", "roleId": "package-steward", "primaryActorId": "github:furkanmamuk", "scope": {"kind": "maintained-root", "root": "packages/runtime-py"}, "effectiveFrom": "2026-07-14", "reviewEvidence": {"decisionId": "sole-maintainer-governance-2026-07-23", "source": "https://github.com/vexil-lang/vexil/issues/75", "reviewedBy": "github:furkanmamuk", "reviewedAt": "2026-07-23"}, "continuityProcedure": "Record containment or a future successor through the unavailable-owner route; no release authority is created.", "status": "active"},
    {"assignmentId": "assignment-package-steward-runtime-go-2026-07-14", "roleId": "package-steward", "primaryActorId": "github:furkanmamuk", "scope": {"kind": "maintained-root", "root": "packages/runtime-go"}, "effectiveFrom": "2026-07-14", "reviewEvidence": {"decisionId": "sole-maintainer-governance-2026-07-23", "source": "https://github.com/vexil-lang/vexil/issues/75", "reviewedBy": "github:furkanmamuk", "reviewedAt": "2026-07-23"}, "continuityProcedure": "Record containment or a future successor through the unavailable-owner route; no release authority is created.", "status": "active"}
  ],
  "continuity": {
    "qualifiedReleaseStewardActorIds": ["github:furkanmamuk"],
    "custodian": null,